ticker,price,priceChange,priceChangeRatio,priceChangeRatio1W,priceChangeRatio1M,id,title,source,publishDate,datime
GEE,26000.0,1100.0,0.044,0.074,0.048,10943956,GEE: Nghị quyết Hội đồng quản trị,HNX,2023-10-02 15:53:00,2312091722
GEE,25000.0,300.0,0.012,-0.004,0.004,10932045,GEE: Thông báo về việc tạm ứng cổ tức năm 2023 (đợt 1) bằng tiền,HNX,2023-09-20 08:02:00,2312091722
GEE,25300.0,300.0,0.012,0.02,0.012,10924804,GEE: Ngày đăng ký cuối cùng trả cổ tức bằng tiền mặt,HNX,2023-09-12 09:17:00,2312091722
GEE,24500.0,100.0,0.004,-0.035,-0.043,10915122,GEE: Nghị quyết Hội đồng quản trị,HNX,2023-08-31 11:00:00,2312091722
GEE,24700.0,0.0,0.0,0.008,-0.035,10912432,GEE: Báo cáo tài chính bán niên năm 2023 (công ty mẹ),HNX,2023-08-29 17:25:00,2312091722
GEE,24700.0,0.0,0.0,0.008,-0.035,10912434,GEE: Báo cáo tài chính bán niên năm 2023,HNX,2023-08-29 17:22:00,2312091722
GEE,24700.0,0.0,0.0,0.008,-0.035,10912378,GEE: Nghị quyết Hội đồng quản trị,HNX,2023-08-29 17:08:00,2312091722
GEE,25400.0,-100.0,-0.004,-0.012,0.041,10889429,GEE: Báo cáo thay đổi sở hữu cổ phiếu của cổ đông lớn - Công ty cổ phần Cơ điện Trần Phú,HNX,2023-08-08 16:44:00,2312091722
GEE,25500.0,-200.0,-0.008,-0.004,0.041,10887659,"GEE: Công ty cổ phần Cơ điện Trần Phú đã mua 2,8 triệu cổ phiếu",HNX,2023-08-07 13:52:00,2312091722
GEE,25300.0,-400.0,-0.016,-0.004,-0.008,10881858,GEE: Nghị quyết Hội đồng quản trị,HNX,2023-08-02 07:29:00,2312091722
GEE,25700.0,100.0,0.004,0.008,0.008,10881077,GEE: Báo cáo quản trị công ty bán niên 2023,HNX,2023-08-01 10:13:00,2312091722
GER,7700.0,0.0,0.0,0.149,-0.105,10989579,GER: Ký hợp đồng kiểm toán Báo cáo tài chính năm 2023,HNX,2023-11-17 18:07:00,2312091722
GER,5200.0,0.0,0.0,-0.395,-0.395,10964112,GER: Nghị quyết Hội đồng quản trị,HNX,2023-10-23 17:02:00,2312091722
GER,10300.0,0.0,0.0,0.144,0.304,10902203,GER: Ngày đăng ký cuối cùng trả cổ tức bằng tiền mặt,HNX,2023-08-18 16:14:00,2312091722
GER,9000.0,0.0,0.0,0.0,0.139,10889554,GER: Nghị quyết Hội đồng quản trị,HNX,2023-08-09 07:36:00,2312091722
GER,9000.0,0.0,0.0,0.0,0.139,10889555,GER: Nghị quyết Hội đồng quản trị,HNX,2023-08-09 07:36:00,2312091722
GER,9000.0,0.0,0.0,0.0,0.139,10889557,GER: Nghị quyết Hội đồng quản trị,HNX,2023-08-09 07:35:00,2312091722
GER,7900.0,0.0,0.0,0.0,0.0,10857874,GER: Báo cáo quản trị công ty bán niên 2023,HNX,2023-07-17 16:57:00,2312091722
GER,,,,,,10736823,GER: Nghị quyết Đại hội đồng cổ đông thường niên năm 2023,HNX,2023-04-01 00:44:00,2312091722
GER,5900.0,0.0,0.0,0.017,-0.048,10708336,GER: Tài liệu họp Đại hội đồng cổ đông,HNX,2023-03-06 09:36:00,2312091722
GER,5900.0,100.0,0.017,0.017,-0.048,10706062,GER: Báo cáo thường niên 2022,HNX,2023-03-02 15:54:00,2312091722
GER,6200.0,400.0,0.069,0.069,-0.016,10703539,GER: Giải trình kết quả sản xuất kinh doanh trên báo cáo tài chính năm 2022,HNX,2023-02-28 16:55:00,2312091722
GER,6200.0,400.0,0.069,0.069,-0.016,10703540,GER: Báo cáo tài chính năm 2022,HNX,2023-02-28 16:54:00,2312091722
GER,5800.0,0.0,0.0,-0.065,0.055,10694527,GER: Nghị quyết Hội đồng quản trị quý 4/2022,HNX,2023-02-21 17:29:00,2312091722
GER,6200.0,0.0,0.0,0.0,-0.031,10681915,GER: Ngày đăng ký cuối cùng Đại hội đồng cổ đông thường niên năm 2023,HNX,2023-02-08 09:45:00,2312091722
GER,6400.0,0.0,0.0,0.0,-0.099,10663593,GER: Nghị quyết Hội đồng quản trị,HNX,2023-01-17 10:39:00,2312091722
GEG,13200.0,250.0,0.019,-0.004,0.052,11006315,GEG:  Báo cáo về thay đổi sở hữu của cổ đông lớn CTCP Thành Thành Công - Biên Hòa,HOSE,2023-11-29 09:46:00,2312091722
GEG,13500.0,250.0,0.019,0.019,0.023,11003070,GEG:  Trích yếu Nghị quyết HĐQT số 28A ngày 21/11/2023,HOSE,2023-11-23 17:38:00,2312091722
GEG,14800.0,300.0,0.021,-0.069,0.017,10948235,GEG:  CBTT nhận được giấy chứng nhận đăng ký chứng khoán thay đổi lần 1,HOSE,2023-10-06 11:02:00,2312091722
GEG,14300.0,250.0,0.018,0.021,-0.074,10914518,Công ty cổ phần Điện Gia Lai Báo cáo tài chính Bán niên (Kỳ báo cáo từ 01/01/2023 đến 30/06/2023) năm 2023,,2023-08-31 09:14:00,2312091722
GEG,14000.0,0.0,0.0,0.007,-0.094,10912531,"GEG:  Báo cáo tình hình thực hiện cam kết đối với người sở hữu trái phiếu và tình hình thanh toán gốc,lãi",HOSE,2023-08-29 19:07:00,2312091722
GEG,15450.0,0.0,0.0,0.003,-0.001,10880140,"GEG:  Báo cáo định kỳ tình hình thanh toán gốc, lãi trái phiếu doanh nghiệp",HOSE,2023-07-31 13:44:00,2312091722
GEG,15450.0,0.0,0.0,0.01,-0.004,10878687,GEG:  Báo cáo tình hình quản trị Công ty 06 tháng đầu năm 2023,HOSE,2023-07-28 15:04:00,2312091722
GEG,15450.0,0.0,0.0,0.01,-0.004,10878276,GEG:  Quyết định về việc thay đổi đăng ký niêm yết,HOSE,2023-07-28 10:19:00,2312091722
GEG,15450.0,0.0,0.0,0.01,-0.004,10878277,GEG:  Thông báo về việc giao dịch chứng khoán thay đổi đăng ký niêm yết,HOSE,2023-07-28 10:18:00,2312091722
GEG,15400.0,100.0,0.007,0.007,0.005,10875059,GEG:  Giấy chứng nhận đăng ký doanh nghiệp thay đổi lần thứ 23,HOSE,2023-07-24 10:22:00,2312091722
GEG,15300.0,0.0,0.0,0.01,-0.026,10874519,GEG:  Thông báo thay đổi giấy chứng nhận ĐKDN lần thứ 23,HOSE,2023-07-21 16:56:00,2312091722
GEG,15300.0,150.0,0.01,0.041,-0.002,10857154,GEG:  Trích yếu Nghị quyết HĐQT số 20A ngày 14/07/2023,HOSE,2023-07-17 11:21:00,2312091722
GEG,14850.0,100.0,0.007,-0.017,-0.04,10854475,GEG:  Thông báo thay đổi số lượng cổ phiếu có quyền biểu quyết đang lưu hành và báo cáo kết quả phát hành,HOSE,2023-07-13 17:27:00,2312091722
GEG,14750.0,-100.0,-0.007,-0.032,-0.055,10851903,GEG:  CBTT ký hợp đồng với đơn vị kiểm toán BCTC năm 2023,HOSE,2023-07-12 08:23:00,2312091722
GEG,14700.0,150.0,0.01,-0.035,-0.058,10849620,GEG:  Trích yếu Nghị quyết HĐQT về việc lựa chọn đơn vị kiểm toán cho năm 2023,HOSE,2023-07-10 13:49:00,2312091722
GGG,4600.0,0.0,0.0,0.0,-0.233,10966282,"Một doanh nghiệp ô tô nội địa 3 tháng không có nửa đồng doanh thu, lỗ 12 năm liên tiếp, ""nợ như Chúa Chổm"" nhưng chưa có ý định ngừng kinh doanh",NSTT,2023-10-25 15:15:00,2312091722
GGG,4600.0,0.0,0.0,-0.098,-0.343,10952221,GGG: Báo cáo tài chính quý 3/2023,HNX,2023-10-11 10:01:00,2312091722
GGG,4600.0,0.0,0.0,-0.098,-0.343,10951614,"Một thương hiệu Ô tô Việt ghi nhận doanh thu 9 tháng chỉ bằng một chiếc xe VinFast VFe34 , lỗ 12 năm liên tiếp, tiền mặt chỉ còn vài trăm triệu",NSTT,2023-10-11 07:18:00,2312091722
GGG,5900.0,-400.0,-0.063,-0.063,-0.063,10901081,GGG: Thông báo về trạng thái chứng khoán,HNX,2023-08-18 09:56:00,2312091722
GGG,5900.0,-400.0,-0.063,-0.063,-0.063,10900938,GGG: Quyết định về việc duy trì diện hạn chế giao dịch,HNX,2023-08-18 09:35:00,2312091722
GGG,6300.0,0.0,0.0,0.0,0.0,10898976,GGG: Giải trình liên quan đến Báo cáo tài chính bán niên 2023,HNX,2023-08-16 18:01:00,2312091722
GGG,6300.0,0.0,0.0,0.0,0.0,10896744,GGG: Báo cáo tài chính bán niên năm 2023,HNX,2023-08-15 10:30:00,2312091722
GGG,6100.0,0.0,0.0,0.0,0.271,10882862,GGG: Nguyễn Duy Kiên - Ủy viên HĐQT - đã mua 951.600 CP,HNX,2023-08-02 14:35:00,2312091722
GGG,6100.0,-200.0,-0.032,-0.032,0.173,10873735,GGG: Nguyễn Duy Kiên - Ủy viên HĐQT - đăng ký mua 951.600 CP,HNX,2023-07-21 10:59:00,2312091722
GGG,6300.0,0.0,0.0,0.145,0.212,10871397,GGG: Báo cáo tài chính quý 2/2023,HNX,2023-07-20 08:48:00,2312091722
GGG,6300.0,0.0,0.0,0.145,0.212,10859015,"Một thương hiệu ô tô Việt Nam báo lỗ 11 năm liên tiếp, doanh thu nửa năm chỉ hơn 1 tỷ, tiền mặt còn ""vỏn vẹn"" vài chục triệu đồng",NSTT,2023-07-18 14:05:00,2312091722
GGG,4800.0,0.0,0.0,0.0,0.171,10835350,GGG: Báo cáo quản trị công ty bán niên 2023,HNX,2023-07-05 13:10:00,2312091722
GGG,4800.0,0.0,0.0,0.0,0.333,10830599,GGG: Ký hợp đồng soát xét và kiểm toán các báo cáo tài chính năm 2023,HNX,2023-06-30 11:08:00,2312091722
GGG,3600.0,0.0,0.0,0.125,0.059,10801763,GGG: Giấy xác nhận về việc thay đổi nội dung đăng ký doanh nghiệp,HNX,2023-06-01 14:32:00,2312091722
GGG,3400.0,-100.0,-0.029,-0.029,-0.261,10761536,GGG: Thay đổi nhân sự,HNX,2023-04-21 18:00:00,2312091722
GEX,21800.0,250.0,0.012,0.009,0.016,11003146,GEX sắp mua lại 200 tỷ trái phiếu trước hạn và sắp hết nợ trái phiếu ngắn hạn,VNE,2023-11-24 08:53:00,2312091722
GEX,22150.0,150.0,0.007,0.133,0.021,10985706,Tập đoàn GELEX có thể thu về hơn 1.000 tỷ đồng từ thương vụ với Sembcorp Industries?,Tạp chí Công th,2023-11-14 12:22:00,2312091722
GEX,,,,,,10983885,GELEX (GEX) thống nhất hợp tác đầu tư cùng Sembcorp,DTCK,2023-11-11 10:29:00,2312091722
GEX,18550.0,-1350.0,-0.068,-0.102,-0.1,10971566,"Kết thúc quý 3, GELEX lãi lũy kế 1.388 tỷ đồng",,2023-10-30 20:30:00,2312091722
GEX,19700.0,500.0,0.026,-0.039,-0.204,10946410,GEX:  CBTT nhận được giấy chứng nhận đăng ký chứng khoán,HOSE,2023-10-04 16:28:00,2312091722
GEX,19200.0,-1400.0,-0.068,0.0,-0.224,10944461,Dragon Capital mua thêm 3 triệu cổ phiếu GELEX (GEX),DTCK,2023-10-03 09:37:00,2312091722
GEX,20600.0,-200.0,-0.01,0.0,-0.168,10943928,GEX:  Báo cáo thay đổi sở hữu của nhóm NĐTNN là CĐL Trương Ngọc Phượng,HOSE,2023-10-02 15:35:00,2312091722
GEX,23750.0,-750.0,-0.031,-0.037,0.131,10934512,GEX:  Quyết định xử phạt vi phạm hành chính về thuế của Cục thuế TP.Hà Nội,HOSE,2023-09-21 17:45:00,2312091722
GEX,23000.0,50.0,0.002,0.075,0.02,10912382,Công ty cổ phần Tập đoàn Gelex Báo cáo tài chính Bán niên (Kỳ báo cáo từ 01/01/2023 đến 30/06/2023) năm 2023,,2023-08-29 17:29:00,2312091722
GEX,23000.0,50.0,0.002,0.075,0.02,10911989,GEX:  Các báo cáo định kỳ về trái phiếu doanh nghiệp,HOSE,2023-08-29 13:42:00,2312091722
GEX,22750.0,-250.0,-0.011,-0.009,0.173,10890865,GEX:  Giấy chứng nhận đăng ký hoạt động Văn phòng  Đại diện TP.HCM,HOSE,2023-08-09 15:13:00,2312091722
GEX,23400.0,-200.0,-0.008,0.038,0.268,10887647,GEX:  Báo cáo thay đổi sở hữu của nhóm NĐTNN là CĐL Trương Ngọc Phượng,HOSE,2023-08-07 14:13:00,2312091722
GEX,22950.0,350.0,0.015,0.011,0.186,10883137,GEX:  Thông báo quyết định xử phạt hành chính về thuế,HOSE,2023-08-02 17:22:00,2312091722
GEX,22550.0,0.0,0.0,0.025,0.165,10880711,GEX:  Báo cáo về thay đổi sở hữu của nhóm NĐTNN là CĐL Trương Ngọc Phượng,HOSE,2023-07-31 17:39:00,2312091722
GEX,22550.0,-300.0,-0.013,0.056,0.156,10879100,GEX:  Báo cáo tình hình quản trị công ty 6 tháng đầu năm 2023,HOSE,2023-07-28 19:35:00,2312091722
GH3,5200.0,0.0,0.0,0.0,0.0,10966398,GH3: Ký hợp đồng kiểm toán Báo cáo tài chính năm 2023,HNX,2023-10-25 16:14:00,2312091722
GH3,5200.0,0.0,0.0,0.0,0.0,10946346,GH3: Thông báo chi trả cổ tức năm 2022 bằng tiền,HNX,2023-10-04 15:54:00,2312091722
GH3,5200.0,0.0,0.0,0.0,0.0,10924716,GH3: Ngày đăng ký cuối cùng trả cổ tức bằng tiền mặt,HNX,2023-09-12 09:17:00,2312091722
GH3,5200.0,0.0,0.0,0.0,-0.071,10919263,GH3: Nghị quyết Hội đồng quản trị,HNX,2023-09-06 15:54:00,2312091722
GH3,5600.0,-400.0,-0.067,-0.2,-0.2,10876447,GH3: Báo cáo quản trị công ty bán niên 2023,HNX,2023-07-26 07:42:00,2312091722
GH3,7000.0,0.0,0.0,0.0,-0.402,10822425,"GH3: Vũ Thanh Tùng - Ủy viên HĐQT, Phó Tổng Giám đốc - đã bán 52.000 CP",HNX,2023-06-22 13:39:00,2312091722
GH3,7000.0,0.0,0.0,0.0,-0.402,10814301,"GH3: Vũ Thanh Tùng - Ủy viên HĐQT, Phó Tổng Giám đốc - đăng ký bán 52.000 CP",HNX,2023-06-14 10:06:00,2312091722
GH3,11700.0,0.0,0.0,0.0,0.0,10764694,GH3: Thay đổi nhân sự,HNX,2023-04-25 15:21:00,2312091722
GH3,11700.0,0.0,0.0,0.0,0.0,10764695,GH3: Nghị quyết Đại hội đồng cổ đông thường niên năm 2023,HNX,2023-04-25 15:20:00,2312091722
GH3,11700.0,0.0,0.0,0.0,0.0,10760266,GH3: Tài liệu họp Đại hội đồng cổ đông,HNX,2023-04-21 09:07:00,2312091722
GH3,11700.0,0.0,0.0,0.0,0.0,10757841,GH3: Báo cáo thường niên 2022,HNX,2023-04-19 16:23:00,2312091722
GH3,11700.0,0.0,0.0,0.0,0.0,10756327,GH3: Tài liệu họp Đại hội đồng cổ đông,HNX,2023-04-18 17:07:00,2312091722
GH3,11700.0,0.0,0.0,0.0,0.147,10738151,GH3: Báo cáo tài chính năm 2022,HNX,2023-04-03 10:31:00,2312091722
GH3,11700.0,0.0,0.0,0.0,0.147,10734948,GH3: Công bố thông tin Đơn từ nhiệm,HNX,2023-03-30 21:47:00,2312091722
GH3,10200.0,0.0,0.0,0.0,-0.121,10707327,GH3: Ngày đăng ký cuối cùng Đại hội đồng cổ đông thường niên năm 2023,HNX,2023-03-03 15:14:00,2312091722
GHC,25500.0,-100.0,-0.004,0.008,0.024,11002970,GHC: Ngày đăng ký cuối cùng trả cổ tức bằng tiền mặt,HNX,2023-11-23 15:22:00,2312091722
GHC,25200.0,-100.0,-0.004,0.008,0.008,10989578,GHC: Nghị quyết Hội đồng quản trị,HNX,2023-11-17 18:08:00,2312091722
GHC,25000.0,300.0,0.012,0.0,0.0,10962845,GHC: Báo cáo tài chính quý 3/2023,HNX,2023-10-20 17:57:00,2312091722
GHC,25000.0,-100.0,-0.004,0.008,0.037,10945317,GHC: Ngô Trường Thạnh - Giám đốc - đã bán 17.400 CP,HNX,2023-10-04 07:57:00,2312091722
GHC,24800.0,0.0,0.0,-0.008,0.042,10941456,GHC: Thay đổi nhân sự,HNX,2023-09-28 14:20:00,2312091722
GHC,25000.0,400.0,0.016,0.037,0.037,10923796,GHC: Ngày đăng ký cuối cùng trả cổ tức bằng tiền mặt,HNX,2023-09-11 13:01:00,2312091722
GHC,24400.0,300.0,0.012,0.025,0.008,10919072,GHC: Nghị quyết Hội đồng quản trị,HNX,2023-09-06 14:05:00,2312091722
GHC,23900.0,100.0,0.004,-0.004,-0.012,10911383,GHC: Ngô Trường Thạnh - Giám đốc - đăng ký bán 70.800 CP,HNX,2023-08-29 09:12:00,2312091722
GHC,24200.0,0.0,0.0,0.0,-0.004,10897032,GHC: Báo cáo tài chính bán niên năm 2023,HNX,2023-08-15 13:52:00,2312091722
GHC,24300.0,1700.0,0.075,-0.004,0.004,10874385,GHC: Xử phạt vi phạm hành chính trong lĩnh vực Hải quan,HNX,2023-07-21 16:01:00,2312091722
GHC,24300.0,1700.0,0.075,-0.004,0.004,10872856,GHC: Báo cáo tài chính quý 2/2023,HNX,2023-07-21 07:00:00,2312091722
GHC,24300.0,0.0,0.0,0.0,0.0,10858672,GHC: Châu Tiểu Phụng - Phó Giám đốc - đã bán 15.000 CP,HNX,2023-07-18 09:54:00,2312091722
GHC,24400.0,100.0,0.004,0.004,0.004,10855812,GHC: Ký hợp đồng kiểm toán Báo cáo tài chính năm 2023,HNX,2023-07-14 15:29:00,2312091722
GHC,24400.0,100.0,0.004,0.004,0.004,10855757,GHC: Nghị quyết Hội đồng quản trị,HNX,2023-07-14 15:28:00,2312091722
GHC,24300.0,0.0,0.0,-0.008,-0.008,10832754,GHC: Thay đổi giấy đăng ký kinh doanh,HNX,2023-07-03 13:32:00,2312091722
GIL,21850.0,-400.0,-0.018,-0.211,-0.331,10973123,Gilimex tiếp tục lỗ và dòng tiền âm kỷ lục trong 9 tháng đầu năm 2023,Báo Đầu tư,2023-11-01 08:54:00,2312091722
GIL,22250.0,-1650.0,-0.069,-0.201,-0.319,10972014,GIL:  Giải trình chênh lệch LNST Q3/2023 so với cùng kỳ năm trước,HOSE,2023-10-31 10:06:00,2312091722
GIL,31900.0,700.0,0.022,-0.023,-0.006,10950091,GIL:  CBTT nhận được bản án có hiệu lực,HOSE,2023-10-09 16:43:00,2312091722
GIL,31650.0,-900.0,-0.028,-0.039,0.048,10927873,GIL:  Giải trình biến động kết quả kinh doanh 6 tháng đầu năm 2023 so với 6 tháng đầu năm 2022,HOSE,2023-09-14 15:28:00,2312091722
GIL,33500.0,550.0,0.017,0.057,0.004,10922446,"Chưa giải trình lợi nhuận nửa đầu năm 2023 giảm mạnh, Gilimex (GIL) bị nhắc nhở",DTCK,2023-09-08 15:42:00,2312091722
GIL,33500.0,550.0,0.017,0.057,0.004,10922390,GIL:  Nhắc nhở chậm CBTT giải trình chênh lệch LNST tại BCTC,HOSE,2023-09-08 15:11:00,2312091722
GIL,,,,,,10916000,Gilimex liên tiếp thiệt hại sau khi Amazon thu hẹp đơn hàng,NSTT,2023-09-01 13:38:00,2312091722
GIL,31550.0,2050.0,0.069,0.101,-0.054,10914287,"Lỗ nửa đầu năm 2023 thêm 44,36 tỷ đồng, cổ phiếu Gilimex (GIL) chính thức bị cắt margin",DTCK,2023-08-31 06:07:00,2312091722
GIL,29500.0,-50.0,-0.002,0.054,-0.115,10914152,Cổ phiếu một doanh nghiệp dệt may có vốn hóa nghìn tỷ vừa bị HoSE cắt margin,NSTT,2023-08-30 17:25:00,2312091722
GIL,29500.0,-50.0,-0.002,0.054,-0.115,10912972,HOSE: Thông báo danh sách bổ sung chứng khoán không đủ điều kiện giao dịch ký quỹ - GIL,HOSE,2023-08-30 08:37:00,2312091722
GIL,29350.0,-150.0,-0.005,0.039,-0.059,10910896,GIL:  Giải trình BCTC công ty mẹ soát xét bán niên năm 2023,HOSE,2023-08-28 16:43:00,2312091722
GIL,33350.0,2150.0,0.069,0.054,0.251,10879841,"6 tháng đầu năm 2023, Gilimex ghi nhận lỗ kỷ lục 43,99 tỷ đồng và dòng tiền âm",Báo Đầu tư,2023-07-31 09:32:00,2312091722
GIL,31200.0,500.0,0.016,-0.02,0.139,10879153,GIL:  Nghị quyết HĐQT về việc phê duyệt BCTC riêng quý 2/2023,HOSE,2023-07-28 20:09:00,2312091722
GIL,31200.0,500.0,0.016,-0.02,0.139,10879184,GIL:  Giải trình chênh lệch lợi nhuận sau thuế quý 2/2023 so với quý 2/2022,HOSE,2023-07-28 19:46:00,2312091722
GIL,31200.0,500.0,0.016,-0.02,0.139,10879101,GIL:  Báo cáo tình hình quản trị công ty 6 tháng đầu năm 2023,HOSE,2023-07-28 19:35:00,2312091722
GIC,15200.0,0.0,0.0,-0.007,-0.013,10965234,GIC: Nghị quyết Hội đồng quản trị,HNX,2023-10-24 16:32:00,2312091722
GIC,15200.0,0.0,0.0,-0.007,-0.013,10964993,GIC: Báo cáo tài chính quý 3/2023,HNX,2023-10-24 13:46:00,2312091722
GIC,14900.0,-800.0,-0.051,-0.013,0.028,10933154,GIC: Nghị quyết Hội đồng quản trị,HNX,2023-09-20 16:59:00,2312091722
GIC,15000.0,0.0,0.0,0.007,0.0,10925501,GIC: Nghị quyết Hội đồng quản trị,HNX,2023-09-12 17:02:00,2312091722
GIC,14900.0,400.0,0.028,-0.007,-0.086,10905243,GIC: Nghị quyết Hội đồng quản trị,HNX,2023-08-22 14:11:00,2312091722
GIC,15000.0,0.0,0.0,0.027,-0.026,10897026,GIC: Báo cáo tài chính bán niên năm 2023,HNX,2023-08-15 14:14:00,2312091722
GIC,15000.0,0.0,0.0,0.014,-0.026,10895815,GIC: Nghị quyết Hội đồng quản trị,HNX,2023-08-14 16:55:00,2312091722
GIC,15500.0,1000.0,0.069,0.006,0.084,10874307,GIC: Báo cáo quản trị công ty bán niên 2023,HNX,2023-07-21 15:53:00,2312091722
GIC,15500.0,1000.0,0.069,0.006,0.084,10874315,GIC: Báo cáo tài chính quý 2/2023,HNX,2023-07-21 15:39:00,2312091722
GIC,16400.0,0.0,0.0,0.123,0.131,10854308,GIC: Thay đổi nhân sự,HNX,2023-07-13 15:19:00,2312091722
GIC,16400.0,300.0,0.019,0.123,0.093,10853076,GIC: Nghị quyết Hội đồng quản trị,HNX,2023-07-12 16:50:00,2312091722
GIC,14600.0,-200.0,-0.014,0.014,0.021,10834064,GIC: CBTT Công ty ký HĐ với đơn vị kiểm toán BCTC 2023,HNX,2023-07-04 14:09:00,2312091722
GIC,14400.0,700.0,0.051,0.0,0.091,10826697,GIC: NQ HĐQT lựa chọn đơn vị kiểm toán BCTC 2023,HNX,2023-06-27 11:03:00,2312091722
GIC,12515.0,-92.0,-0.007,0.047,0.063,10757357,GIC: Báo cáo tài chính quý 1/2023,HNX,2023-04-19 13:42:00,2312091722
GIC,12607.0,556.0,0.046,0.03,0.071,10756251,GIC: Ngày đăng ký cuối cùng trả cổ tức bằng tiền mặt,HNX,2023-04-18 17:19:00,2312091722
GKM,33900.0,-200.0,-0.006,-0.006,0.034,10987143,GKM: CTCP Chứng khoán APG không còn là cổ đông lớn,HNX,2023-11-15 16:35:00,2312091722
GKM,34500.0,400.0,0.012,0.012,0.045,10981862,GKM: CTCP Chứng khoán APG đã bán 500.000 CP,HNX,2023-11-09 10:45:00,2312091722
GKM,34100.0,-500.0,-0.014,0.006,0.033,10980902,GKM:  CTCP Chứng khoán APG đã bán 545.000 CP,HNX,2023-11-08 15:27:00,2312091722
GKM,34500.0,400.0,0.012,0.015,0.018,10976252,GKM: Báo cáo thay đổi sở hữu cổ phiếu của cổ đông lớn - CTCP Chứng khoán APG,HNX,2023-11-03 09:07:00,2312091722
GKM,34500.0,400.0,0.012,0.015,0.018,10976360,GKM: Báo cáo thay đổi sở hữu cổ phiếu của cổ đông lớn - CTCP Chứng khoán APG,HNX,2023-11-03 09:03:00,2312091722
GKM,33900.0,-200.0,-0.006,-0.015,-0.003,10972710,GKM: Báo cáo thay đổi sở hữu cổ phiếu của cổ đông lớn - CTCP Chứng khoán APG,HNX,2023-10-31 15:29:00,2312091722
GKM,33900.0,-200.0,-0.006,-0.015,-0.003,10972387,GKM: Báo cáo thay đổi sở hữu cổ phiếu của cổ đông lớn - CTCP Chứng khoán APG,HNX,2023-10-31 13:52:00,2312091722
GKM,33900.0,-200.0,-0.006,-0.015,-0.003,10972322,GKM: Báo cáo tài chính quý 3/2023,HNX,2023-10-31 13:30:00,2312091722
GKM,33900.0,-200.0,-0.006,-0.015,-0.003,10972323,GKM: Báo cáo tài chính quý 3/2023 (công ty mẹ),HNX,2023-10-31 13:29:00,2312091722
GKM,34000.0,-100.0,-0.003,0.006,-0.017,10969779,GKM: Báo cáo thay đổi sở hữu cổ phiếu của cổ đông lớn - CTCP Chứng khoán APG,HNX,2023-10-27 17:09:00,2312091722
GKM,34400.0,400.0,0.012,0.049,-0.017,10964335,GKM: Thay đổi giấy đăng ký kinh doanh,HNX,2023-10-24 08:32:00,2312091722
GKM,33700.0,800.0,0.024,0.027,-0.056,10960753,GKM: CTCP Chứng khoán APG đã mua 817.000 CP,HNX,2023-10-19 14:56:00,2312091722
GKM,32900.0,100.0,0.003,0.0,-0.076,10959548,GKM: Nghị quyết Hội đồng quản trị,HNX,2023-10-18 17:14:00,2312091722
GKM,32200.0,-600.0,-0.018,-0.03,-0.098,10955271,GKM: Thay đổi người công bố thông tin,HNX,2023-10-13 17:17:00,2312091722
GKM,32200.0,-600.0,-0.018,-0.03,-0.098,10955272,GKM: Thay đổi nhân sự,HNX,2023-10-13 17:16:00,2312091722
GLC,10000.0,0.0,0.0,0.0,0.0,10820142,GLC: Báo cáo quản trị công ty bán niên 2023,HNX,2023-06-20 16:35:00,2312091722
GLC,10000.0,0.0,0.0,0.0,0.0,10774959,GLC: Nghị quyết Đại hội đồng cổ đông thường niên năm 2023,HNX,2023-05-08 11:49:00,2312091722
GLC,10000.0,0.0,0.0,0.0,0.0,10757151,GLC: Giải trình liên quan đến Báo cáo tài chính năm 2022,HNX,2023-04-19 10:33:00,2312091722
GLC,10000.0,0.0,0.0,0.0,0.0,10757152,GLC: Báo cáo thường niên 2022,HNX,2023-04-19 10:31:00,2312091722
GLC,10000.0,0.0,0.0,0.0,0.0,10734940,GLC: Báo cáo tài chính năm 2022,HNX,2023-03-30 21:15:00,2312091722
GLC,10000.0,0.0,0.0,0.0,0.0,10718949,GLC: Ngày đăng ký cuối cùng Đại hội đồng cổ đông thường niên năm 2023,HNX,2023-03-15 13:59:00,2312091722
GLC,10000.0,0.0,0.0,0.0,0.0,10714650,GLC: Ký hợp đồng kiểm toán Báo cáo tài chính năm 2022,HNX,2023-03-10 16:02:00,2312091722
GLC,10000.0,0.0,0.0,0.0,0.0,10713437,GLC: Thông báo về ngày đăng ký cuối cùng để thực hiện quyền tham dự Đại hội đồng cổ đông thường niên năm 2023,HNX,2023-03-10 07:52:00,2312091722
GLC,10000.0,0.0,0.0,0.0,0.0,10667710,GLC: Báo cáo quản trị công ty năm 2022,HNX,2023-01-19 15:03:00,2312091722
GLC,10000.0,0.0,0.0,0.0,0.0,10640115,GLC: Thay đổi nhân sự,HNX,2022-12-19 17:43:00,2312091722
GLC,10000.0,0.0,0.0,0.0,0.0,10638158,GLC: Thông báo về việc thay đổi mẫu dấu công ty,HNX,2022-12-16 10:33:00,2312091722
GLC,10000.0,0.0,0.0,0.0,0.0,10451497,GLC: Thông báo về việc thay đổi người chịu trách nhiệm công bố thông tin,HNX,2022-08-01 14:41:00,2312091722
GLC,10000.0,0.0,0.0,0.0,0.0,10409831,GLC: Báo cáo quản trị công ty bán niên 2022,HNX,2022-07-11 11:27:00,2312091722
GLC,10000.0,0.0,0.0,0.0,0.0,10409785,GLC: Nghị quyết Đại hội đồng cổ đông thường niên năm 2022,HNX,2022-07-11 10:56:00,2312091722
GLC,10000.0,0.0,0.0,0.0,0.0,10340243,GLC: Ngày đăng ký cuối cùng Đại hội đồng cổ đông thường niên năm 2022,HNX,2022-05-24 11:04:00,2312091722
GLT,18000.0,-1000.0,-0.053,-0.053,-0.076,11003420,GLT: Báo cáo tài chính bán niên năm 2023,HNX,2023-11-24 15:43:00,2312091722
GLT,18000.0,-1000.0,-0.053,-0.053,-0.076,11003395,GLT: Nghị quyết Hội đồng quản trị,HNX,2023-11-24 15:26:00,2312091722
GLT,19000.0,-1.0,0.0,0.0,-0.025,11002790,GLT: Báo cáo tài chính bán niên năm 2023 (công ty mẹ),HNX,2023-11-23 10:13:00,2312091722
GLT,19001.0,0.0,0.0,-0.049,-0.025,10988280,GLT: Ngày đăng ký cuối cùng trả cổ tức bằng tiền mặt,HNX,2023-11-16 17:14:00,2312091722
GLT,19001.0,-974.0,-0.049,0.032,-0.025,10986042,GLT: Cbtt Thông báo ngày đăng ký cuối cùng nhận cổ tức đợt 3 của năm 2022,HNX,2023-11-14 17:04:00,2312091722
GLT,19001.0,-974.0,-0.049,0.032,-0.025,10985579,GLT: Nghị quyết Hội đồng quản trị,HNX,2023-11-14 09:37:00,2312091722
GLT,19488.0,0.0,0.0,0.0,-0.134,10969029,GLT: Báo cáo tài chính quý 2/2023,HNX,2023-10-27 10:59:00,2312091722
GLT,19488.0,0.0,0.0,0.0,-0.134,10969109,GLT: Báo cáo tài chính quý 2/2023 (công ty mẹ),HNX,2023-10-27 10:58:00,2312091722
GLT,22509.0,0.0,0.0,0.1,0.155,10940518,GLT: GLT_Thông báo ký hợp đồng kiểm toán năm 2023,HNX,2023-09-27 16:32:00,2312091722
GLT,19293.0,585.0,0.031,0.076,-0.02,10905244,GLT: Nghị quyết Hội đồng quản trị,HNX,2023-08-22 14:10:00,2312091722
GLT,19975.0,0.0,0.0,0.051,0.079,10889572,"GLT: Ngày 26/05/2025, ngày giao dịch đầu tiên 406.564 cổ phiếu niêm yết bổ sung",HNX,2023-08-08 08:46:00,2312091722
GLT,19488.0,-487.0,-0.024,0.01,0.026,10878598,GLT: Quyết định chấp thuận niêm yết bổ sung 406.564 cổ phiếu,HNX,2023-07-28 14:51:00,2312091722
